{
    "_id":"OEBT0020000007",
    "_schema": "https://www.elixir-europe.org/excelerate/WP2/json-schemas/1.0/Tool",
    "activation": "2018-04-05T00:00:00.000+0000",
    "description": "Cancer Driver Genes prediction",
    "is_automated": true,
    "name": "OncodriveCLUST",
    "references": [
        "doi:10.1093/bioinformatics/btt395"
    ],
    "status": "unknown",
    "tool_access": [
        {
            "tool_access_type": "other"
        }
    ],
    "tool_contact_ids": [
        "David.Tamborero"
    ]
}
